{
  "schema_version": 1,
  "account_id": "GIGA-HWK",
  "account_num_id": 3,
  "order_id": "broker-order-12345",
  "sequence": 2,
  "created_at": "2026-09-27T09:30:00-04:00",
  "updated_at": "2026-09-27T09:30:05-04:00",
  "symbol": "AAPL",
  "side": "BUY",
  "order_type": "LIMIT",
  "status": "PARTIALLY_FILLED",
  "quantity": 100,
  "filled_quantity": 40,
  "average_fill_price": 200.12,
  "limit_price": 200.5,
  "currency": "USD",
  "time_in_force": "DAY",
  "command_id": "ktrader-command-12345",
  "message": "40 shares filled; 60 remaining"
}
